{
    "$schema": "https://json-schema.org/draft/2020-12/schema",
    "$id": "https://snowarch.github.io/inir-hub/schema/hub.schema.json",
    "title": "iNiR Hub listing",
    "description": "hub.json: how an item appears in the Hub. The item's own file (widget.json, theme.json, manifest.json) is what iNiR reads.",
    "type": "object",
    "required": [
        "version",
        "summary",
        "authors",
        "license"
    ],
    "additionalProperties": false,
    "properties": {
        "$schema": {
            "type": "string"
        },
        "version": {
            "type": "string",
            "pattern": "^\\d+\\.\\d+\\.\\d+$",
            "description": "x.y.z; raise it with every change"
        },
        "summary": {
            "type": "string",
            "minLength": 8,
            "maxLength": 90,
            "description": "One line for the card"
        },
        "description": {
            "type": "string",
            "maxLength": 600
        },
        "authors": {
            "type": "array",
            "minItems": 1,
            "items": {
                "type": "string",
                "pattern": "^[A-Za-z0-9][A-Za-z0-9-]{0,38}$"
            },
            "description": "GitHub handles"
        },
        "license": {
            "type": "string",
            "minLength": 2,
            "description": "SPDX id, e.g. MIT"
        },
        "tags": {
            "type": "array",
            "maxItems": 6,
            "items": {
                "type": "string",
                "pattern": "^[a-z0-9-]{2,20}$"
            }
        },
        "permissions": {
            "type": "array",
            "uniqueItems": true,
            "items": {
                "enum": [
                    "process",
                    "network",
                    "files",
                    "inject"
                ]
            }
        },
        "minInir": {
            "type": "string",
            "pattern": "^\\d+\\.\\d+\\.\\d+$",
            "description": "Oldest iNiR it works on"
        },
        "preview": {
            "type": "string",
            "pattern": "\\.(webp|png|jpe?g)$",
            "description": "Screenshot in the item folder"
        }
    }
}
