{
    "$schema": "../../schema/hub.schema.json",
    "version": "1.0.0",
    "summary": "Any command, drawn as a bar, a figure or lines",
    "authors": [
        "snowarch"
    ],
    "license": "MIT",
    "tags": [
        "system",
        "terminal",
        "example"
    ],
    "permissions": [
        "process"
    ],
    "minInir": "2.33.0",
    "preview": "preview.webp"
}
